{
  "case_count": 46,
  "cases": [
    {
      "case_id": "alpha-shared-term",
      "category": "retrieval",
      "expected_outcome": "matched",
      "expected_source_version_ids": [
        "version-matter-alpha-text",
        "version-matter-alpha-image",
        "version-matter-alpha-audio"
      ],
      "matter_id": "matter-alpha",
      "observed_outcome": "matched",
      "observed_source_version_ids": [
        "version-matter-alpha-text",
        "version-matter-alpha-image",
        "version-matter-alpha-audio"
      ],
      "operation": "search",
      "passed": true
    },
    {
      "case_id": "bravo-shared-term",
      "category": "retrieval",
      "expected_outcome": "matched",
      "expected_source_version_ids": [
        "version-matter-bravo-text",
        "version-matter-bravo-image",
        "version-matter-bravo-audio"
      ],
      "matter_id": "matter-bravo",
      "observed_outcome": "matched",
      "observed_source_version_ids": [
        "version-matter-bravo-text",
        "version-matter-bravo-image",
        "version-matter-bravo-audio"
      ],
      "operation": "search",
      "passed": true
    },
    {
      "case_id": "alpha-search-bravo",
      "category": "cross_matter_bypass",
      "expected_outcome": "denied",
      "expected_source_version_ids": [],
      "matter_id": "matter-bravo",
      "observed_outcome": "denied",
      "observed_source_version_ids": [],
      "operation": "search",
      "passed": true
    },
    {
      "case_id": "bravo-search-alpha",
      "category": "cross_matter_bypass",
      "expected_outcome": "denied",
      "expected_source_version_ids": [],
      "matter_id": "matter-alpha",
      "observed_outcome": "denied",
      "observed_source_version_ids": [],
      "operation": "search",
      "passed": true
    },
    {
      "case_id": "alpha-source-bravo",
      "category": "cross_matter_bypass",
      "expected_outcome": "denied",
      "expected_source_version_ids": [],
      "matter_id": "matter-bravo",
      "observed_outcome": "denied",
      "observed_source_version_ids": [],
      "operation": "source_lookup",
      "passed": true
    },
    {
      "case_id": "bravo-source-alpha",
      "category": "cross_matter_bypass",
      "expected_outcome": "denied",
      "expected_source_version_ids": [],
      "matter_id": "matter-alpha",
      "observed_outcome": "denied",
      "observed_source_version_ids": [],
      "operation": "source_lookup",
      "passed": true
    },
    {
      "case_id": "alpha-foreign-source",
      "category": "cross_matter_bypass",
      "expected_outcome": "denied",
      "expected_source_version_ids": [],
      "matter_id": "matter-alpha",
      "observed_outcome": "denied",
      "observed_source_version_ids": [],
      "operation": "source_lookup",
      "passed": true
    },
    {
      "case_id": "bravo-foreign-source",
      "category": "cross_matter_bypass",
      "expected_outcome": "denied",
      "expected_source_version_ids": [],
      "matter_id": "matter-bravo",
      "observed_outcome": "denied",
      "observed_source_version_ids": [],
      "operation": "source_lookup",
      "passed": true
    },
    {
      "case_id": "mixed-retrieval-results",
      "category": "cross_matter_bypass",
      "expected_outcome": "denied",
      "expected_source_version_ids": [],
      "matter_id": "matter-alpha",
      "observed_outcome": "denied",
      "observed_source_version_ids": [],
      "operation": "mixed_results",
      "passed": true
    },
    {
      "case_id": "closing-retrieval",
      "category": "cross_matter_bypass",
      "expected_outcome": "denied",
      "expected_source_version_ids": [],
      "matter_id": "matter-alpha",
      "observed_outcome": "denied",
      "observed_source_version_ids": [],
      "operation": "content_guard",
      "passed": true
    },
    {
      "case_id": "closed-retrieval",
      "category": "cross_matter_bypass",
      "expected_outcome": "denied",
      "expected_source_version_ids": [],
      "matter_id": "matter-alpha",
      "observed_outcome": "denied",
      "observed_source_version_ids": [],
      "operation": "content_guard",
      "passed": true
    },
    {
      "case_id": "closing-source-resolution",
      "category": "cross_matter_bypass",
      "expected_outcome": "denied",
      "expected_source_version_ids": [],
      "matter_id": "matter-alpha",
      "observed_outcome": "denied",
      "observed_source_version_ids": [],
      "operation": "content_guard",
      "passed": true
    },
    {
      "case_id": "closed-source-resolution",
      "category": "cross_matter_bypass",
      "expected_outcome": "denied",
      "expected_source_version_ids": [],
      "matter_id": "matter-alpha",
      "observed_outcome": "denied",
      "observed_source_version_ids": [],
      "operation": "content_guard",
      "passed": true
    },
    {
      "case_id": "unknown-actor-search",
      "category": "cross_matter_bypass",
      "expected_outcome": "denied",
      "expected_source_version_ids": [],
      "matter_id": "matter-alpha",
      "observed_outcome": "denied",
      "observed_source_version_ids": [],
      "operation": "search",
      "passed": true
    },
    {
      "case_id": "ticket-wrong-actor",
      "category": "ticket_lease_bypass",
      "expected_outcome": "denied",
      "expected_source_version_ids": [],
      "matter_id": "matter-alpha",
      "observed_outcome": "denied",
      "observed_source_version_ids": [],
      "operation": "wrong_actor",
      "passed": true
    },
    {
      "case_id": "ticket-wrong-action",
      "category": "ticket_lease_bypass",
      "expected_outcome": "denied",
      "expected_source_version_ids": [],
      "matter_id": "matter-alpha",
      "observed_outcome": "denied",
      "observed_source_version_ids": [],
      "operation": "wrong_action",
      "passed": true
    },
    {
      "case_id": "ticket-changed-object",
      "category": "ticket_lease_bypass",
      "expected_outcome": "denied",
      "expected_source_version_ids": [],
      "matter_id": "matter-alpha",
      "observed_outcome": "denied",
      "observed_source_version_ids": [],
      "operation": "changed_object",
      "passed": true
    },
    {
      "case_id": "ticket-changed-revision",
      "category": "ticket_lease_bypass",
      "expected_outcome": "denied",
      "expected_source_version_ids": [],
      "matter_id": "matter-alpha",
      "observed_outcome": "denied",
      "observed_source_version_ids": [],
      "operation": "changed_revision",
      "passed": true
    },
    {
      "case_id": "ticket-closing-ticket",
      "category": "ticket_lease_bypass",
      "expected_outcome": "denied",
      "expected_source_version_ids": [],
      "matter_id": "matter-alpha",
      "observed_outcome": "denied",
      "observed_source_version_ids": [],
      "operation": "closing_ticket",
      "passed": true
    },
    {
      "case_id": "ticket-unknown-ticket",
      "category": "ticket_lease_bypass",
      "expected_outcome": "denied",
      "expected_source_version_ids": [],
      "matter_id": "matter-alpha",
      "observed_outcome": "denied",
      "observed_source_version_ids": [],
      "operation": "unknown_ticket",
      "passed": true
    },
    {
      "case_id": "ticket-malformed-uri",
      "category": "ticket_lease_bypass",
      "expected_outcome": "denied",
      "expected_source_version_ids": [],
      "matter_id": "matter-alpha",
      "observed_outcome": "denied",
      "observed_source_version_ids": [],
      "operation": "malformed_uri",
      "passed": true
    },
    {
      "case_id": "ticket-expired",
      "category": "ticket_lease_bypass",
      "expected_outcome": "denied",
      "expected_source_version_ids": [],
      "matter_id": "matter-alpha",
      "observed_outcome": "denied",
      "observed_source_version_ids": [],
      "operation": "expired",
      "passed": true
    },
    {
      "case_id": "ticket-replay",
      "category": "ticket_lease_bypass",
      "expected_outcome": "denied",
      "expected_source_version_ids": [],
      "matter_id": "matter-alpha",
      "observed_outcome": "denied",
      "observed_source_version_ids": [],
      "operation": "replay",
      "passed": true
    },
    {
      "case_id": "ticket-revoked-ticket",
      "category": "ticket_lease_bypass",
      "expected_outcome": "denied",
      "expected_source_version_ids": [],
      "matter_id": "matter-alpha",
      "observed_outcome": "denied",
      "observed_source_version_ids": [],
      "operation": "revoked_ticket",
      "passed": true
    },
    {
      "case_id": "ticket-wrong-helper-lease",
      "category": "ticket_lease_bypass",
      "expected_outcome": "denied",
      "expected_source_version_ids": [],
      "matter_id": "matter-alpha",
      "observed_outcome": "denied",
      "observed_source_version_ids": [],
      "operation": "wrong_helper_lease",
      "passed": true
    },
    {
      "case_id": "ticket-changed-revision-lease",
      "category": "ticket_lease_bypass",
      "expected_outcome": "denied",
      "expected_source_version_ids": [],
      "matter_id": "matter-alpha",
      "observed_outcome": "denied",
      "observed_source_version_ids": [],
      "operation": "changed_revision_lease",
      "passed": true
    },
    {
      "case_id": "ticket-revoked-actor-lease",
      "category": "ticket_lease_bypass",
      "expected_outcome": "denied",
      "expected_source_version_ids": [],
      "matter_id": "matter-alpha",
      "observed_outcome": "denied",
      "observed_source_version_ids": [],
      "operation": "revoked_actor_lease",
      "passed": true
    },
    {
      "case_id": "ticket-closing-lease",
      "category": "ticket_lease_bypass",
      "expected_outcome": "denied",
      "expected_source_version_ids": [],
      "matter_id": "matter-alpha",
      "observed_outcome": "denied",
      "observed_source_version_ids": [],
      "operation": "closing_lease",